{
  "title": "Cayman Cookout",
  "subtitle": "An Epicurean Celebration",
  "date_range": "January 8-11, 2027",
  "location": "The Ritz-Carlton, Grand Cayman",
  "description": "Join world-renowned chefs for four days of tastings, demonstrations, and beachfront dinners.",
  "price": "From $495 per person",
  "call_to_action": "Reserve Now",
  "contact": "cookout@ritzcarlton.com",
  "hero_image_asset": ""
}
